{"active_behavior_authorization":false,"aggregates":[{"axis_id":"buffer_copy_coalescing","byte_count":200,"connection_key":"connection.buffer.inactive","epoch_sequence":1,"operation_count":1,"outcome_contract_version":2,"outcome_id":"outcome.inactive","run_id":"run.buffer.memory_conservative.candidate.reviewed_80113e61","source_operation_identities":[{"axis_id":"buffer_copy_coalescing","connection_key":"connection.buffer.inactive","decision_instance_id":1,"epoch_sequence":1,"identity_version":1,"operation_id":1,"operation_key":"operation_identity_v1:e5d046df985f4d84e010a04a3d513e5e32c3b00156c448d571d9ff4e8a51bac7","run_id":"run.buffer.memory_conservative.candidate.reviewed_80113e61"}],"work_count":2},{"axis_id":"buffer_copy_coalescing","byte_count":400,"connection_key":"connection.buffer.fallback","epoch_sequence":1,"operation_count":1,"outcome_contract_version":2,"outcome_id":"outcome.clamped","run_id":"run.buffer.memory_conservative.candidate.reviewed_80113e61","source_operation_identities":[{"axis_id":"buffer_copy_coalescing","connection_key":"connection.buffer.fallback","decision_instance_id":1,"epoch_sequence":1,"identity_version":1,"operation_id":1,"operation_key":"operation_identity_v1:25a2e1cff4bdf86c964e6b3fe6b0e5529dcca020a119b67b262b4ea1ba83cb2a","run_id":"run.buffer.memory_conservative.candidate.reviewed_80113e61"}],"work_count":4}],"behavior_catalog_ref":{"document_id":"adaptive_runtime_effective_behavior_catalog_v2","schema_version":"adaptive-runtime-effective-behavior-catalog-v2","document_version":2,"content_sha256":"2f0515c7f43ed8b20bf849c172ce3c1d14621794da097bf88a56ef93c7cc634a"},"classification_set_ref":{"document_id":"classifications.run.buffer.memory_conservative.candidate.reviewed_80113e61","schema_version":"adaptive-runtime-classification-set-v1","document_version":1,"content_sha256":"3df53850ad282f0efc619d852be3404d8a1e322066742f8937d124bd813182f5"},"content_sha256":"fe1c88a551e1e6b8269e3cccae1d43d8f4ec1f0e9b0303d5b66f7164333aabfd","derivations":[{"derivation_status":"behavior_only","error_code":null,"operation_identity":{"axis_id":"buffer_copy_coalescing","connection_key":"connection.buffer.positive","decision_instance_id":1,"epoch_sequence":1,"identity_version":1,"operation_id":1,"operation_key":"operation_identity_v1:e47180066503912ef433024f8133f8df3952c2251c6d7a61c9bfe262c563deb4","run_id":"run.buffer.memory_conservative.candidate.reviewed_80113e61"},"outcome_id":null,"requires_retained_classification":null,"result_kind":"applied"},{"derivation_status":"behavior_only","error_code":null,"operation_identity":{"axis_id":"buffer_copy_coalescing","connection_key":"connection.buffer.rollback","decision_instance_id":1,"epoch_sequence":1,"identity_version":1,"operation_id":1,"operation_key":"operation_identity_v1:b32549ad6d24c1e389e5bd177e2ed254a8f7be946f106de020c4247ad3691979","run_id":"run.buffer.memory_conservative.candidate.reviewed_80113e61"},"outcome_id":null,"requires_retained_classification":null,"result_kind":"applied"},{"derivation_status":"behavior_only","error_code":null,"operation_identity":{"axis_id":"buffer_copy_coalescing","connection_key":"connection.buffer.shadow","decision_instance_id":1,"epoch_sequence":1,"identity_version":1,"operation_id":1,"operation_key":"operation_identity_v1:58d915ecfb2901f02c327114fd98e983965774588b8a69b1916c55d385d78826","run_id":"run.buffer.memory_conservative.candidate.reviewed_80113e61"},"outcome_id":null,"requires_retained_classification":null,"result_kind":"applied"},{"derivation_status":"matched","error_code":null,"operation_identity":{"axis_id":"buffer_copy_coalescing","connection_key":"connection.buffer.fallback","decision_instance_id":1,"epoch_sequence":1,"identity_version":1,"operation_id":1,"operation_key":"operation_identity_v1:25a2e1cff4bdf86c964e6b3fe6b0e5529dcca020a119b67b262b4ea1ba83cb2a","run_id":"run.buffer.memory_conservative.candidate.reviewed_80113e61"},"outcome_id":"outcome.clamped","requires_retained_classification":true,"result_kind":"clamped"},{"derivation_status":"matched","error_code":null,"operation_identity":{"axis_id":"buffer_copy_coalescing","connection_key":"connection.buffer.inactive","decision_instance_id":1,"epoch_sequence":1,"identity_version":1,"operation_id":1,"operation_key":"operation_identity_v1:e5d046df985f4d84e010a04a3d513e5e32c3b00156c448d571d9ff4e8a51bac7","run_id":"run.buffer.memory_conservative.candidate.reviewed_80113e61"},"outcome_id":"outcome.inactive","requires_retained_classification":true,"result_kind":"inactive"}],"document_id":"materialization.outcome.v2.operation_evidence.run.buffer.memory_conservative.candidate.reviewed_80113e61","document_version":2,"performance_acceptance_authorization":false,"retained_classifications":[{"classification_id":"classification.buffer_copy_coalescing.connection.buffer.fallback.clamped","kind":"clamped","reason_code":"reason.clamped","retained":true,"target":{"axis_id":"buffer_copy_coalescing","connection_key":"connection.buffer.fallback","decision_instance_id":1,"epoch_sequence":1,"operation_id":1,"run_id":"run.buffer.memory_conservative.candidate.reviewed_80113e61","target_kind":"operation"}},{"classification_id":"classification.buffer_copy_coalescing.connection.buffer.fallback.release","kind":"diagnostic_context","reason_code":"reason.diagnostic_context","retained":true,"target":{"axis_id":"buffer_copy_coalescing","connection_key":"connection.buffer.fallback","decision_instance_id":1,"epoch_sequence":1,"operation_id":1,"release_epoch_sequence":1,"run_id":"run.buffer.memory_conservative.candidate.reviewed_80113e61","target_kind":"release"}},{"classification_id":"classification.buffer_copy_coalescing.connection.buffer.inactive.inactive","kind":"inactive","reason_code":"reason.inactive","retained":true,"target":{"axis_id":"buffer_copy_coalescing","connection_key":"connection.buffer.inactive","decision_instance_id":1,"epoch_sequence":1,"operation_id":1,"run_id":"run.buffer.memory_conservative.candidate.reviewed_80113e61","target_kind":"operation"}},{"classification_id":"classification.buffer_copy_coalescing.connection.buffer.inactive.release","kind":"diagnostic_context","reason_code":"reason.diagnostic_context","retained":true,"target":{"axis_id":"buffer_copy_coalescing","connection_key":"connection.buffer.inactive","decision_instance_id":1,"epoch_sequence":1,"operation_id":1,"release_epoch_sequence":1,"run_id":"run.buffer.memory_conservative.candidate.reviewed_80113e61","target_kind":"release"}},{"classification_id":"classification.buffer_copy_coalescing.connection.buffer.positive.analytically_eligible","kind":"analytically_eligible","reason_code":"reason.analytically_eligible","retained":true,"target":{"axis_id":"buffer_copy_coalescing","connection_key":"connection.buffer.positive","decision_instance_id":1,"epoch_sequence":1,"operation_id":1,"run_id":"run.buffer.memory_conservative.candidate.reviewed_80113e61","target_kind":"operation"}},{"classification_id":"classification.buffer_copy_coalescing.connection.buffer.positive.release","kind":"diagnostic_context","reason_code":"reason.diagnostic_context","retained":true,"target":{"axis_id":"buffer_copy_coalescing","connection_key":"connection.buffer.positive","decision_instance_id":1,"epoch_sequence":1,"operation_id":1,"release_epoch_sequence":1,"run_id":"run.buffer.memory_conservative.candidate.reviewed_80113e61","target_kind":"release"}},{"classification_id":"classification.buffer_copy_coalescing.connection.buffer.rollback.analytically_eligible","kind":"analytically_eligible","reason_code":"reason.analytically_eligible","retained":true,"target":{"axis_id":"buffer_copy_coalescing","connection_key":"connection.buffer.rollback","decision_instance_id":1,"epoch_sequence":1,"operation_id":1,"run_id":"run.buffer.memory_conservative.candidate.reviewed_80113e61","target_kind":"operation"}},{"classification_id":"classification.buffer_copy_coalescing.connection.buffer.rollback.release","kind":"diagnostic_context","reason_code":"reason.diagnostic_context","retained":true,"target":{"axis_id":"buffer_copy_coalescing","connection_key":"connection.buffer.rollback","decision_instance_id":1,"epoch_sequence":1,"operation_id":1,"release_epoch_sequence":1,"run_id":"run.buffer.memory_conservative.candidate.reviewed_80113e61","target_kind":"release"}},{"classification_id":"classification.buffer_copy_coalescing.connection.buffer.shadow.analytically_eligible","kind":"analytically_eligible","reason_code":"reason.analytically_eligible","retained":true,"target":{"axis_id":"buffer_copy_coalescing","connection_key":"connection.buffer.shadow","decision_instance_id":1,"epoch_sequence":1,"operation_id":1,"run_id":"run.buffer.memory_conservative.candidate.reviewed_80113e61","target_kind":"operation"}},{"classification_id":"classification.buffer_copy_coalescing.connection.buffer.shadow.release","kind":"diagnostic_context","reason_code":"reason.diagnostic_context","retained":true,"target":{"axis_id":"buffer_copy_coalescing","connection_key":"connection.buffer.shadow","decision_instance_id":1,"epoch_sequence":1,"operation_id":1,"release_epoch_sequence":1,"run_id":"run.buffer.memory_conservative.candidate.reviewed_80113e61","target_kind":"release"}}],"schema_version":"adaptive-runtime-operation-outcome-materialization-v2","source_evidence_ref":{"document_id":"operation_evidence.run.buffer.memory_conservative.candidate.reviewed_80113e61","schema_version":"adaptive-runtime-operation-evidence-v3","document_version":3,"content_sha256":"8bc5c222fbf5172daa975d9fdfe156f64ef878aecec7b7881e8f27023a97f34d"},"trace_references":{"architecture_ids":["ARC-QUIC-CRT-0104"],"requirement_ids":["REQ-QUIC-CRT-0218","REQ-QUIC-CRT-0219","REQ-QUIC-CRT-0220","REQ-QUIC-CRT-0221","REQ-QUIC-CRT-0222"],"verification_ids":["VER-QUIC-CRT-0106"],"work_item_ids":["WI-QUIC-CRT-0105"]}}