{"active_behavior_authorization":false,"aggregates":[],"behavior_catalog_ref":{"document_id":"adaptive_runtime_effective_behavior_catalog_v3","schema_version":"adaptive-runtime-effective-behavior-catalog-v3","document_version":3,"content_sha256":"c7cb2d1c39f6ba02bd631a214e62769ec1e099d1ef3abb03db315d38c2ef5db8"},"classification_set_ref":{"document_id":"classifications.run.send_admission_composition.correctness.a5","schema_version":"adaptive-runtime-classification-set-v1","document_version":1,"content_sha256":"41b25617e1f794a7ee26c6b0bb0ac625b94f717f304dcf5d8a5dd453636f8629"},"content_sha256":"6197ed41f3f86ff68d346fae7697fc743015a1545df67e762330a00a583914ba","derivations":[{"derivation_status":"behavior_only","error_code":null,"operation_identity":{"axis_id":"application_send_batch_formation","connection_key":"connection.send_admission_composition.correctness.a5.batch","decision_instance_id":10,"epoch_sequence":1,"identity_version":1,"operation_id":10,"operation_key":"operation_identity_v1:a058395163b14b61dc310d3ca42cb008ad8e685246be3159114edab1c44d5840","run_id":"run.send_admission_composition.correctness.a5"},"outcome_id":null,"requires_retained_classification":null,"result_kind":"applied"},{"derivation_status":"behavior_only","error_code":null,"operation_identity":{"axis_id":"buffer_copy_coalescing","connection_key":"connection.send_admission_composition.correctness.a5.buffer","decision_instance_id":1,"epoch_sequence":1,"identity_version":1,"operation_id":1,"operation_key":"operation_identity_v1:f72d57b34ebe40221d15276606bb107df92cee42c9ae21be1ba8bbf8e59301bc","run_id":"run.send_admission_composition.correctness.a5"},"outcome_id":null,"requires_retained_classification":null,"result_kind":"applied"},{"derivation_status":"behavior_only","error_code":null,"operation_identity":{"axis_id":"oversized_write_admission_quantum","connection_key":"connection.send_admission_composition.correctness.a5.oversized","decision_instance_id":1,"epoch_sequence":1,"identity_version":1,"operation_id":1,"operation_key":"operation_identity_v1:7f782f8631ab831c6442d999986c51bbf0b7a7d1eca9db8ca17fb42eadeced00","run_id":"run.send_admission_composition.correctness.a5"},"outcome_id":null,"requires_retained_classification":null,"result_kind":"applied"}],"document_id":"materialization.outcome.v2.operation_evidence.run.send_admission_composition.correctness.a5","document_version":2,"performance_acceptance_authorization":false,"retained_classifications":[{"classification_id":"classification.application_send_batch_formation.connection.send_admission_composition.correctness.a5.batch.analytically_eligible","kind":"analytically_eligible","reason_code":"reason.correctness_opportunity","retained":true,"target":{"axis_id":"application_send_batch_formation","connection_key":"connection.send_admission_composition.correctness.a5.batch","decision_instance_id":10,"epoch_sequence":1,"operation_id":10,"run_id":"run.send_admission_composition.correctness.a5","target_kind":"operation"}},{"classification_id":"classification.buffer_copy_coalescing.connection.send_admission_composition.correctness.a5.buffer.analytically_eligible","kind":"analytically_eligible","reason_code":"reason.correctness_opportunity","retained":true,"target":{"axis_id":"buffer_copy_coalescing","connection_key":"connection.send_admission_composition.correctness.a5.buffer","decision_instance_id":1,"epoch_sequence":1,"operation_id":1,"run_id":"run.send_admission_composition.correctness.a5","target_kind":"operation"}},{"classification_id":"classification.buffer_copy_coalescing.connection.send_admission_composition.correctness.a5.buffer.release","kind":"diagnostic_context","reason_code":"reason.owner_release","retained":true,"target":{"axis_id":"buffer_copy_coalescing","connection_key":"connection.send_admission_composition.correctness.a5.buffer","decision_instance_id":1,"epoch_sequence":1,"operation_id":1,"release_epoch_sequence":1,"run_id":"run.send_admission_composition.correctness.a5","target_kind":"release"}},{"classification_id":"classification.oversized_write_admission_quantum.connection.send_admission_composition.correctness.a5.oversized.analytically_eligible","kind":"analytically_eligible","reason_code":"reason.correctness_opportunity","retained":true,"target":{"axis_id":"oversized_write_admission_quantum","connection_key":"connection.send_admission_composition.correctness.a5.oversized","decision_instance_id":1,"epoch_sequence":1,"operation_id":1,"run_id":"run.send_admission_composition.correctness.a5","target_kind":"operation"}}],"schema_version":"adaptive-runtime-operation-outcome-materialization-v2","source_evidence_ref":{"document_id":"operation_evidence.run.send_admission_composition.correctness.a5","schema_version":"adaptive-runtime-operation-evidence-v4","document_version":4,"content_sha256":"445a5175fc2b89190be3d6ece76c4d0cae65e7846b7e8601ecb52a69ce21cc91"},"trace_references":{"architecture_ids":["ARC-QUIC-CRT-0116"],"requirement_ids":["REQ-QUIC-CRT-0241","REQ-QUIC-CRT-0242","REQ-QUIC-CRT-0243","REQ-QUIC-CRT-0244","REQ-QUIC-CRT-0245","REQ-QUIC-CRT-0246"],"verification_ids":["VER-QUIC-CRT-0118"],"work_item_ids":["WI-QUIC-CRT-0117"]}}